,Dyad,Session,Time_begin,P1,P2,SD,QE,SV,PR,HD,a,sca,b,scb,c,scc,d,scd,e,sce
652,10,1,00:38:41.400000,that is the worst thing I've ever done,,,,x,,,let me try no no press the button oh my god that is the worst thing I've ever done,90,that's all right now,86.0,oh what did I do,86.0,yay no next one I suppose,86.0,I think so,86.0
606,10,1,00:36:24.400000,,I'm not sure,,,x,,,yeah it might do that if you're hovering over it I'm not sure,90,and I always split it down the middle on the equals sign like that,86.0,because they said not to give you the answers,86.0,so I don't want to just do it,86.0,okay wait a minute I'm sorry,86.0
14382,6,1,00:44:37.700000,and that would be kind of problematic,,,,,,x,so if you subtracted y then there would be zero ys and that would be kind of problematic,90,so when you get negative one hundred and six equals two y divided by two divided by two negative fifty-three okay is that right probably,86.0,I was writing that upside down that whole time,48.0,okay so add y to both sides like you're saying,41.0,okay oh,39.0
10467,3,2,00:19:18.100000,,pause filler I guess this side,,,,,x,pause filler I guess this side,90,so this one is going to be plus sixty-one to both sides,86.0,just work through the first step really quick because I'm confused just,86.0,like this side over here,66.0,because that's like (inaudible),48.0
561,10,1,00:33:29.600000,I really don't know why people think that,,x,,,,,I really don't know why people think that like it's cool to say like how's your school,90,I dont know,86.0,yeah that would be fun,86.0,how bad my grades this year I'm going to  I have a C in math others are all As,86.0,people don't just stop by pause filler (laughter),48.0
10817,3,2,00:49:18.300000,pause filler ops one second I think pause filler oh actually a way to scroll down,,,,,,x,ops one second,90,actually a way to scroll down,90.0,no that one,86.0,I'll just try and go with it,86.0,yes you divide a hundred and three,86.0
543,10,1,00:32:37.500000,,because I'm pretty sure you're in that room,x,,,,,like I'm not going to do this but (inaudible) on that wall and you could hear me because I'm pretty sure you're in that room I could be wrong,90,we're in different rooms,86.0,I'm pretty sure we just hear each other super loud due to the earphone,86.0,and they ask questions that you usually wouldn't ask in real life but,86.0,but they're just commonly questions like what's your favorite subject or what are your hobbies but,86.0
532,10,1,00:32:03.100000,it's just annoying,,x,,,,,yeah I know it's not (inaudible) it's just annoying,90,this is like standing in a room with somebody you know it's just like what do I do,86.0,I know it's just,68.0,I don't know,47.0,yeah I have no idea what to do right now,43.0
11090,4,1,00:27:53.500000,,it's easier to just subtract that y,,,,,x,thirteen y plus twenty-seven pause filler it's easier to just subtract that y,90,so you get twelve y plus twenty-seven equals negative seventy-three,86.0,you get twelve y equals pause filler twenty-seven negative seventy-three a hundred negative one hundred,86.0,okay and negative one hundred twelfths or y equals negative pause filler twenty-five thirds,86.0,because you can reduce it okay pause filler a hundred okay,86.0
11164,4,1,00:35:35.300000,and then we read,,x,,,,,and she rambles a little bit and then she keeps talking and then we read and she gives us work and then we leave,90,and it's crazy,60.0,like he yells at us and he gets really mad and it's almost funny and you hate him and it's just a routine now which is sort of bad but sort of funny,57.0,my homeroom teacher lectures us like at least once a week,45.0,oh,45.0
11165,4,1,00:35:36.900000,and she gives us work,,x,,,,,and she rambles a little bit and then she keeps talking and then we read and she gives us work and then we leave,90,yeah my history teacher she'll start talking about the lesson,86.0,and it's crazy,86.0,my homeroom teacher lectures us like at least once a week,86.0,like he yells at us and he gets really mad and it's almost funny and you hate him and it's just a routine now which is sort of bad but sort of funny,86.0
9835,3,1,00:29:41.900000,,well this year my spring break actually lasted three weeks because I went to Florida the week that everyone went back to school (laughter),,,,,x,well this year my spring break actually lasted three weeks because I went to Florida,90,well this year my spring break actually lasted three weeks because I went to Florida,90.0,do you guys even get a spring break,86.0,we don't even get a week we get like three days,86.0,how long is your winter break,86.0
11166,4,1,00:35:38.000000,and then we leave,,x,,,,,and she rambles a little bit and then she keeps talking and then we read and she gives us work and then we leave,90,like he yells at us and he gets really mad and it's almost funny and you hate him and it's just a routine now which is sort of bad but sort of funny,57.0,yeah my history teacher she'll start talking about the lesson,56.0,and it's crazy,52.0,my homeroom teacher lectures us like at least once a week,45.0
9829,3,1,00:29:22.900000,oh I mean I think it was like oh it was like it was somewhere between one and two weeks,,x,,,,,I mean I think it was like,90,it was like,90.0,it was somewhere between one and two weeks,90.0,I mean I think it was like,90.0,it was like,90.0
9823,3,1,00:29:07.700000,,we don't even get a week,x,,,,,we don't even get a week we get like three days,90,we don't even get a week we get like three days,90.0,wait so is your school a private school,86.0,yeah we get like eleven or twelve days,86.0,the week that everyone went back to school (laughter),86.0
9347,3,1,00:02:17.000000,,I just can't see the problem,,,,,x,I see green on most of the pages I just can't see the problem,90,I see green on most of the pages I just can't see the problem,90.0,wait I can't,86.0,umm I'll go to a page keep going on pages I can all I see is different pages with like scribbles and stuff,86.0,wait I can't,86.0
1540,10,2,00:40:07.400000,uh-huh (laughter),,,,x,,,uh-huh (laughter),90,I don't know what the heck we're doing anyway,45.0,what are we doing (laughter),45.0,two hundred forty,45.0,whoa pointless (inaudible) on that (laughter),45.0
9365,3,1,00:03:19.300000,,my name is McKenna,x,,,,,my name is McKenna what about you,90,my name is McKenna what about you,90.0,is this it,86.0,is it x minus six equals thirteen,86.0,wait is it three plus x equals twenty-two,86.0
9366,3,1,00:03:21.100000,,what about you,,x,,,,my name is McKenna what about you,90,my name is McKenna what about you,90.0,wait what's your name,86.0,so what grade are you in,86.0,wait what's your name,86.0
1528,10,2,00:39:24.200000,what are we doing (laughter),,,,x,,,what are we doing (laughter),90,I don't know what the heck we're doing anyway,86.0,yeah what is this,50.0,so negative three (inaudible) but yeah,48.0,I want to get rid of all that,48.0
1519,10,2,00:39:05.000000,ah goodbye (laughter),,,,x,,,ah goodbye (laughter),90,yeah well let's try it twenty-four so twenty-four zero zero not twenty-four zero,43.0,so negative three (inaudible) but yeah,36.0,I want to get rid of all that,36.0,that looks like an upside down sock,36.0
9413,3,1,00:05:42.700000,,okay great great,,,,x,,wait are you on the yeah okay great great all right thank you,90,wait are you on the yeah okay great great all right thank you,90.0,all right great,65.0,all right great,65.0,oh okay it's working,54.0
9423,3,1,00:06:25.900000,I go to SciTech,,,,x,,,I go to SciTech what about you,90,I go to SciTech what about you,90.0,I mean I like math because it I mean it's sort of fun,86.0,yeah I'm on the same page umm did they change your page or,86.0,I mean I like math because it I mean it's sort of fun,86.0
9424,3,1,00:06:26.600000,what about you,,,,x,,,I go to SciTech what about you,90,I go to SciTech what about you,90.0,yeah accidentally got like this it's like over the things you can't really erase,86.0,okay yeah so they exactly know what's happening,86.0,but you got yeah homework listed and all that those are unfun stuff,86.0
9485,3,1,00:09:44.200000,,so it would be k equals six,,,,,x,then those who cancel out so it would be k equals six,90,then those who cancel out so it would be k equals six,90.0,so you would subtract eleven because it's a positive right,86.0,yeah yeah yeah yeah so you'd have to divide because it's multiplication then you do the opposites so divided by forty,86.0,I have to take a moment to think now because I'm so accustomed in my class to using calculators like she lets us,86.0
9532,3,1,00:11:59.100000,,so are you an advanced then,,,x,,,so are you an advanced then because you're an algebra in the seventh grade,90,so are you an advanced then because you're an algebra in the seventh grade,90.0,it seems so embarrassing because it's just like we're so used to using calculators but it just,86.0,and English is more my subject like I'm in advanced English all the time but,86.0,it seems so embarrassing because it's just like we're so used to using calculators but it just,86.0
9533,3,1,00:12:01.100000,,because you're an algebra in the seventh grade,,,x,,,so are you an advanced then because you're an algebra in the seventh grade,90,so are you an advanced then because you're an algebra in the seventh grade,90.0,it seems so embarrassing because it's just like we're so used to using calculators but it just,86.0,and English is more my subject like I'm in advanced English all the time but,86.0,all right so now you add,86.0
9535,3,1,00:12:05.500000,so what I'm doing at the moment I'm taking a full year of algebra one,,,,x,,,umm yes so what I'm doing at the moment I'm taking a full year of algebra one but at the same time I'm also taking geometry,90,umm yes so what I'm doing at the moment I'm taking a full year of algebra one but at the same time I'm also taking geometry,90.0,it's a two yeah a two,86.0,it's a two yeah a two,86.0,yeah so,57.0
9536,3,1,00:12:09.300000,but at the same time I'm also taking geometry,,,,x,,,umm yes so what I'm doing at the moment I'm taking a full year of algebra one but at the same time I'm also taking geometry,90,umm yes so what I'm doing at the moment I'm taking a full year of algebra one but at the same time I'm also taking geometry,90.0,four times that that's also yeah it's five,52.0,four times that that's also yeah it's five,52.0,yeah so,49.0
9545,3,1,00:12:30.800000,,and English is more my subject,,,x,,,and English is more my subject like I'm in advanced English all the time but,90,and English is more my subject like I'm in advanced English all the time but,90.0,and I'm like right where I should be in my grade,86.0,and then you're left with thirteen p equals fifty,86.0,and I'm like right where I should be in my grade,86.0
9546,3,1,00:12:32.800000,,like I'm in advanced English all the time,,,x,,,and English is more my subject like I'm in advanced English all the time but,90,and English is more my subject like I'm in advanced English all the time but,90.0,all right great,86.0,so are you an advanced then because you're an algebra in the seventh grade,86.0,math it's all right I just,86.0
9573,3,1,00:14:01.800000,,sorry I'm getting over a cold,,,x,,,sorry I'm getting over a cold so that's why I sound,90,sorry I'm getting over a cold so that's why I sound,90.0,does the fifty divided by thirteen equal out to a fraction,86.0,I thought that it could've been a simplified fraction I was not sure,86.0,so with this one it's a little bit different but you just subtract ten,86.0
9574,3,1,00:14:04.100000,,so that's why I sound,,,x,,,sorry I'm getting over a cold so that's why I sound,90,sorry I'm getting over a cold so that's why I sound,90.0,I thought that it could've been a simplified fraction I was not sure,86.0,so with this one it's a little bit different but you just subtract ten,86.0,twenty-four so then you divide by,86.0
9671,3,1,00:19:17.600000,,I can't talk I'm sorry pause filler,,,,,x,so fifty-eight equals seven k so is fifty-eight divisible by a seven I can't talk I'm sorry umm,90,so fifty-eight equals seven k so is fifty-eight divisible by a seven I can't talk I'm sorry umm,90.0,I'm just going to write over it you know what,86.0,don't,86.0,I'm just going to write over it you know what,86.0
9712,3,1,00:22:09.200000,pause filler I'm pretty sure that doesn't matter,,,,,,x,pause filler I'm pretty sure that doesn't matter but yeah if you want to write that around,90,pause filler I'm pretty sure that doesn't matter but yeah if you want to write that around,90.0,get rid of that eight,86.0,get rid of that eight,86.0,that would be a negative twelve I'm pretty sure,69.0
9729,3,1,00:23:05.700000,,so you're basically just adding it,,,,,x,oh so yeah it would still be a negative so you're basically just adding it but it's a negative,90,oh so yeah it would still be a negative so you're basically just adding it but it's a negative,90.0,yeah you subtract u,86.0,from both sides so you'd end up with negative forty-two,86.0,yeah you,86.0
9759,3,1,00:24:41.100000,,fifty-five all right great,,,,x,,all right,90,fifty five,90.0,fifty-five,90.0,all right,90.0,fifty five,90.0
9804,3,1,00:28:12.700000,,and I'm getting them on,x,,,,,all my friends are getting their braces off and I'm getting them on,90,all my friends are getting their braces off and I'm getting them on,90.0,they're supposed to be sweet and sour,86.0,better eat all the gummy candy I can because,86.0,they're supposed to be sweet and sour,86.0
9805,3,1,00:28:15.300000,well my teeth were like bad,,x,,,,,well,90,well,90.0,my teeth are like,86.0,bad and I have to,86.0,but since they're like so bad I need to get a second pair,86.0
951,10,2,00:01:51.600000,pause filler a couple of days ago,,x,,,,,pause filler a couple of days ago,90,I all I have is I have a mouse,86.0,because apparently one of the pens broke,86.0,yup,60.0,I do,45.0
9824,3,1,00:29:08.700000,,we get like three days,x,,,,,we don't even get a week we get like three days,90,we don't even get a week we get like three days,90.0,do you guys even get a spring break,86.0,yeah we get like eleven or twelve days,86.0,well this year my spring break actually lasted three weeks because I went to Florida,86.0
11170,4,1,00:35:46.000000,like he yells at us,,x,,,,,like he yells at us and he gets really mad and it's almost funny and you hate him and it's just a routine now which is sort of bad but sort of funny,90,and she rambles a little bit and then she keeps talking and then we read and she gives us work and then we leave,86.0,my homeroom teacher lectures us like at least once a week,86.0,yeah my history teacher she'll start talking about the lesson,52.0,and it's crazy,34.0
16771,7,2,00:38:32.300000,,red well,,,x,,,red,90,okay well do that,86.0,well I think you're supposed to be black,86.0,rebel (laughter),56.0,then that will cancel out right,53.0
11176,4,1,00:36:04.200000,,but I've only been there like two days,x,,,,,I had a homeroom teacher but I've only been there like two days,90,because the other days I've been sitting outside a stairwell waiting to go up to a class at the high school,86.0,and because no teacher is ever there we just play on our phones the entire time,86.0,and I'm with a few other kids,46.0,it's really boring,45.0
226,10,1,00:13:58.800000,,yeah okay pause filler I'm sorry,,,x,,,yeah,90,okay,90.0,yeah,90.0,that looks like an r oops okay,86.0,yeah okay pause filler I'm sorry,86.0
225,10,1,00:13:57.400000,it has to have the answer,,,,x,,,well it doesn't have to be perfect just it has to have the answer,90,I got it too,86.0,and that the same thing is,56.0,me too na I am the same,55.0,because you're trying to find the k,48.0
12112,5,1,00:19:33.400000,,right so plus because pause filler we're just doing the opposite on the other side,,,,,x,right so plus ,90,so I got that in mind now,86.0,let's see how we would oh wait so we would,86.0,add nine to the negative nine and forty-one,86.0,I can't draw on this,86.0
224,10,1,00:13:50.300000,well it doesn't have to be perfect just,,,,x,,,well it doesn't have to be perfect just it has to have the answer,90,I got it too,86.0,and that the same thing is,45.0,because you're trying to find the k,44.0,like what plus eleven would equal seventeen,44.0
190,10,1,00:11:34.100000,so I'm guessing I'll do achy nose achy nose ah (laughter) so just that like minus eight to each side I think,,,,x,,,so I'm guessing I'll do achy nose achy nose ah ,90,so then you can like double check it by nineteen minus six equals,86.0,so let's see if I can do that while messing out,86.0,yeah I'm trying to get down good,86.0,I am not good at this,86.0
155,10,1,00:09:47.600000,,so just do your best,,,x,,,it's okay I already kind of understand this so just do your best,90,pause filler just don't push the button,86.0,okay like the opposite operation all right should I do this,86.0,plus six so that would mean x equal to,86.0,yup,60.0
11174,4,1,00:35:53.600000,and it's just a routine now which is sort of bad but sort of funny,,,,,,x,like he yells at us and he gets really mad and it's almost funny and you hate him and it's just a routine now which is sort of bad but sort of funny,90,and she rambles a little bit and then she keeps talking and then we read and she gives us work and then we leave,86.0,and it's crazy,86.0,yeah my history teacher she'll start talking about the lesson,43.0,my one friend at she goes to Hampton,40.0
154,10,1,00:09:45.300000,,I already kind of understand this,,,x,,,it's okay I already kind of understand this so just do your best,90,that's all I was told,86.0,okay I'm ready,86.0,okay like the opposite operation all right should I do this,86.0,or should you do this,86.0
12320,5,1,00:31:54.900000,pause filler negative pixel,,x,,,,,pause filler negative pixel,90,so and it's N-E-G-A-T-I-V-E P-I-C-K-S-A-L,51.0,yeah,45.0,and it's not the way you'd think it be spelled,45.0,I have a YouTube channel,43.0
153,10,1,00:09:44.700000,,it's okay,,,x,,,it's okay I already kind of understand this so just do your best,90,okay,90.0,yup I see it same place you are,86.0,that's all I was told,86.0,okay I'm ready,86.0
148,10,1,00:09:35.100000,yeah (laughter),,,,x,,,yeah (laughter),90,here we go (laughter),45.0,don't press anything,45.0,just solve the problem (laughter),45.0,so I have no idea how to explain this (laughter),45.0
50,10,1,00:03:23.600000,,I always like joke around about it because you know like Ms. Frizzle from like the Magic School Bus or whatever,x,,,,,yeah pause filler right now I have Ms. Domingo and Ms. Frizzle which is really funny because Ms. Frizzle I always like joke around about it because you know like Ms. Frizzle from like the Magic School Bus or whatever,90,but I know it's like really really brighter like,86.0,okay yeah I don't think I have any Darbys in any of my classes,86.0,seventh yeah so we could have made in the same class but,86.0,Kinsley nope I don't,86.0
17,10,1,00:01:53.800000,,exactly because before that I was home schooled,x,,,,,exactly because before that I was home schooled so it's like it's not exactly cyber school but its still similar,90,I know right,86.0,I know that by now,86.0,pause filler two years I think,86.0,and before that I did another cyber school that wasn't as good (laughter),86.0
7,10,1,00:01:29.000000,,pause filler two years I think,x,,,,,pause filler two years I think,90,because I'm on page two right now,86.0,I'm like I'm in cyber school I know that,86.0,and before that I did another cyber school that wasn't as good (laughter),86.0,yeah but then I'm actually pause filler switching schools to like a private school next year,86.0
13383,5,2,00:42:32.300000,so I'm also that kid so pause filler,,,,x,,,so I'm also that kid so pause filler,90,ah so I get who the kind of person you are now,86.0,so I'm just going to finish the rest of this problem,86.0,and I'm just going to talk and make sure I kind of get it right all right,86.0,so basically there's this one kid in our class,86.0
13390,5,2,00:43:04.300000,I'm like Daniel I don't think you understand pause filler how one kid who just talked about a kid's white shoes just pause filler who create a meme somehow,,,,x,,,I'm like Daniel I don't think you understand ,90,and he's sort of my friend,86.0,but he's really not,86.0,and basically yeah I'm the kid who could be making friends with pretty much anyone,86.0,so I'm also that kid so pause filler,86.0
13434,5,2,00:45:22.300000,(laughter) beautiful,,,,x,x,,(laughter) beautiful,90,uh-oh this is the part where you start hiccupping,40.0,all right now that isn't right pause filler,40.0,well good thing I didn't eat mine as fast as you did,38.0,all right fifty-four,34.0
13615,5,2,00:53:24.400000,one hundred and thirty-seven pause filler equals oh god my brain is like melting now,,,,x,,,one hundred and thirty-seven ,90,all right and then five,86.0,oh yeah there's an x there,86.0,pause filler equals oh god my brain is like melting now,83.0,oh,57.0
13683,5,2,00:56:45.500000,(laughter) they're catchy,,,,x,,,(laughter) they're catchy,90,I see what we're doing,86.0,yeah Attack on Titan has a really catchy one,86.0,and then like you're just watching like,86.0,oh yeah not to mention the only thing I really like about Japanese cartoons is like the opening theme songs,45.0
13700,5,2,00:57:34.600000,but that's really it (laughter),,,,x,,,but that's really it (laughter),90,yeah Attack on Titan has a really catchy one,86.0,I had to be I mean I had to be honest like really,86.0,yeah (sfx) it sounds like fricking like Naruto at first,86.0,there's fricking giant naked people fighting each other for god's sakes,86.0
13775,6,1,00:02:27.300000,because then I have a calculator (inaudible) person,,x,,,,,because then I have a calculator ,90,(inaudible) person,90.0,and I was just sat on my phone,86.0,and then they took it,86.0,no they left me,51.0
13889,6,1,00:11:35.600000,that would be pause filler,,,,,,x,pause filler that would be four and,90,that would be pause filler,90.0,oh it's going to be a fraction,86.0,that�s probably oh over there okay,86.0,why does it keep doing that,86.0
13928,6,1,00:13:33.700000,right they're actually twenty problems (sfx) oh my god just x me out,,,,,,x,right they're actually twenty problems,90,(sfx) oh my god just x me out,90.0,and then you're going to get a fraction yes,86.0,and then you would subtract eight k right,86.0,right,60.0
14159,6,1,00:29:17.100000,because I'm really hungry,,x,,,,,but I'm going to eat them because i'm really hungry,90,(inaudible) I ate lunch at ike eleven forty-five,86.0,eww it tastes like not like gross I don�t know when you're like five,86.0,yeah it's not exactly letting me write there easily,40.0,these ones actually aren't that disgusting (inaudible) hopefully,40.0
17611,8,2,00:19:51.600000,,you just multiply negative eighty-six by seven divided by thirteen,,,,,x,divided by thirteen,90,it's six,57.0,,0.0,,0.0,,0.0
269,10,1,00:16:01.400000,zero where is the calculator (laughter),,,,x,,,zero,90,zero equals,86.0,where is the calculator (laughter),86.0,so they're coming,45.0,I know this is hard,43.0
270,10,1,00:16:05.800000,,I don't know,,,x,,,I don't know wait there's a bunch of other tools,90,pause filler I don't know (inaudible) I'm pretty sure they want us to do it on the screen,90.0,like I'm good with concepts,86.0,but like computation I'm slow at it,86.0,but we weren't told what those are,86.0
12266,5,1,00:27:55.400000,so I guess that's why they use this so (inaudible) yeah so,,,,,,x,so I guess that's why they use this so,90,but I am really good at using it,86.0,that is terrifying,86.0,alright so,86.0,this one is a bit easier I guess,86.0
311,10,1,00:18:30.700000,I wish calculator up (laughter),,,,x,,,I wish calculator up (laughter),90,so am I,86.0,cool I might need over here a little bit but that's just because I'm looking at those,86.0,so yeah like do you think what I have is like twelve y twelve y equals twenty-four so,86.0,and I'm just going twelve over twelve,86.0
11852,5,1,00:03:46.300000,,pause filler I'm okay,x,,,,,pause filler I'm okay,90,yeah it's like if reward is involved I will do it,86.0,well all the money I earn I'm in debt to my parents,86.0,and I'll still have some money in the future I guess,86.0,surprisingly I have a b in the class which I did not think I have,57.0
518,10,1,00:31:33.800000,,do you usually like wear glasses,,x,,,,do you usually like wear glasses because that makes no sense,90,yeah it's not like something major like going partially blind or something,86.0,it's not like something major like going partially blind or something so I wouldn't be worried about it,86.0,oh no it fell,41.0,huh that's weird,40.0
512,10,1,00:31:10.500000,thirty-second rule (laughter) I don't know why my eye keep twitching,,x,,,,,I don't know,90,thirty-second rule ,90.0,I don't know why my eye keep twitching,90.0,I don't know,90.0,my bangs are long,86.0
11211,4,1,00:39:00.400000,,yeah,,,x,,,yeah yeah I I see,90,yeah the pen's a little weird to use,60.0,so uh do you need any help solving this or do you think you know what you are doing,30.0,if you do anything wrong I will just tell you,30.0,I had one math teacher who was just pause filler crazy,30.0
11218,4,1,00:39:14.700000,yeah it's really it's really weird,,,,x,,,it's really weird,90,yeah it's really it's really weird my math teacher is a nut job,90.0,instead of subtracting my teacher yells at us to do it so,86.0,that's easy,86.0,wow this is really weird,70.0
11219,4,1,00:39:16.800000,my math teacher is a nut job,,,,x,,,yeah it's really it's really weird my math teacher is a nut job,90,instead of subtracting my teacher yells at us to do it so,86.0,I add the opposite,40.0,that's easy,40.0,what (laughs),38.0
11306,4,1,00:55:35.700000,this is really weird,,,,x,,,this is really weird I hear music outside of my room,90,I'm moving this p over here,43.0,I'm moving this one to here,38.0,so plus negative p (inaudible) one eighty-two plus negative two p equals forty,38.0,okay negative two p,34.0
