Begin Time - hh:mm:ss.ms,End Time - hh:mm:ss.ms,Duration - hh:mm:ss.ms,Experimenter,P1,P2
00:52:57.471,00:52:58.858,00:00:01.387,,,just one girl
00:52:58.858,00:52:59.157,00:00:00.299,,who,
00:52:59.277,00:53:00.374,00:00:01.097,,,her name is Elena
00:53:01.189,00:53:02.899,00:00:01.710,,oh I like met her once,
00:53:02.899,00:53:02.959,00:00:00.060,,oh I like met her once,yeah
00:53:02.959,00:53:03.175,00:00:00.216,,oh I like met her once,
00:53:07.716,00:53:11.100,00:00:03.384,,but you know what Ellis here last two years you don't have to wear uniform apparently,
00:53:11.100,00:53:13.240,00:00:02.140,,I'm just kind of like well that's amazing,
00:53:13.265,00:53:17.346,00:00:04.081,,,I know I think it's like whenever you're a senior you don't have to wear uniform
00:53:17.720,00:53:20.360,00:00:02.640,,at Winchester it's like we have a dress code,
00:53:20.360,00:53:22.250,00:00:01.890,,but we don't care if you follow it,
00:53:22.614,00:53:24.659,00:00:02.045,,,yeah it's like get to those business casual
00:53:24.659,00:53:25.218,00:00:00.559,,,but I don't think any
00:53:25.218,00:53:29.179,00:00:03.961,,no no but there were these kids who wear these skinny jeans and t-shirts,
00:53:29.269,00:53:33.400,00:00:04.131,,it's like I want to actually care it's what I guess it's nice don't you think,
00:53:36.622,00:53:36.712,00:00:00.090,,,yeah
00:53:37.251,00:53:46.610,00:00:09.359,,I mean like I'm so sick of (inaudible) that it's like you have to dress nice like I was wearing this sweatshirt and it's a Michigan on it,
00:53:46.610,00:53:49.134,00:00:02.524,,and I got yelled that it was a school colors it's like,
00:53:49.134,00:53:49.240,00:00:00.106,,and I got yelled that it was a school colors it's like,I see you don't have the uniform
00:53:49.240,00:53:50.301,00:00:01.061,,,I see you don't have the uniform
00:53:50.870,00:53:52.150,00:00:01.280,,we have a uniform yeah,
00:53:52.556,00:53:52.975,00:00:00.419,,,oh
00:53:53.350,00:54:00.920,00:00:07.570,,we have to wear solid-colored skirts that go down to at least the knees or solid-colored pants or solid-colored shorts,
00:54:00.920,00:54:02.840,00:00:01.920,,but nobody wear shorts really except the boys,
00:54:03.270,00:54:06.000,00:00:02.730,,and then we'd have to wear shoes as long as clothes are towed,
00:54:06.000,00:54:07.262,00:00:01.262,,and it doesn't matter what our socks are,
00:54:07.482,00:54:11.762,00:00:04.280,,so wear any solid-colored shirt colored shirt,
00:54:11.762,00:54:13.210,00:00:01.448,,and our sweatshirts have to say (inaudible),
00:54:13.210,00:54:14.920,00:00:01.710,,and it can have a hood on them,
00:54:15.244,00:54:15.590,00:00:00.346,,,that is kind of strict
00:54:15.590,00:54:17.310,00:00:01.720,,and sweaters they changed the rule every day,that is kind of strict
00:54:17.310,00:54:20.010,00:00:02.700,,and sweaters they changed the rule every day,
00:54:20.240,00:54:22.960,00:00:02.720,,some days are like oh it's okay that your sweater is multicolored,
00:54:22.960,00:54:24.922,00:00:01.962,,and somebody say like you have to take that up,
00:54:24.922,00:54:26.568,00:00:01.646,,or I'm giving you detention,
00:54:26.938,00:54:27.666,00:00:00.728,,,oh wow
00:54:29.020,00:54:32.170,00:00:03.150,,like if I were against the school just like a black Star Wars voucher,
00:54:32.170,00:54:33.350,00:00:01.180,,I would get yelled at,
00:54:33.872,00:54:34.660,00:00:00.788,,,that sucks
00:54:35.540,00:54:36.566,00:00:01.026,,it's really warm,
00:54:36.566,00:54:36.865,00:00:00.299,,it's really warm,the school I go to now Folk
00:54:36.865,00:54:38.312,00:00:01.447,,,the school I go to now Folk
00:54:38.402,00:54:38.779,00:00:00.377,,,it's like no uniform
00:54:38.779,00:54:39.644,00:00:00.865,,yeah they're,it's like no uniform
00:54:39.644,00:54:40.597,00:00:00.953,,,it's like no uniform
00:54:40.666,00:54:41.774,00:00:01.108,,,not many rules
00:54:41.774,00:54:44.358,00:00:02.584,,,there's no such thing as detention (laughter) so
00:54:45.256,00:54:46.919,00:00:01.663,,I've never actually got detention,
00:54:46.932,00:54:51.094,00:00:04.162,,like I'm shocked that Winchester accepted me because I've gotten so many points,
00:54:51.189,00:54:52.560,00:00:01.371,,like I haven't gotten detention,
00:54:52.560,00:54:54.392,00:00:01.832,,but I got points which kind of lead up to detention,
00:54:54.986,00:55:02.432,00:00:07.446,,and I'm also bad and I get really bad grades so I don't understand how they will accept me,
00:55:03.944,00:55:04.327,00:00:00.383,,,yeah I might like after two years at Ellis my parents will like me switch schools
00:55:04.327,00:55:04.948,00:00:00.621,what should I ,,yeah I might like after two years at Ellis my parents will like me switch schools
00:55:04.948,00:55:09.301,00:00:04.353,,,yeah I might like after two years at Ellis my parents will like me switch schools
00:55:09.301,00:55:10.549,00:00:01.248,,,so I might go to Winchester
00:55:11.270,00:55:12.300,00:00:01.030,,that would be nice,
00:55:12.300,00:55:14.013,00:00:01.713,,so then I'd have another friend,
00:55:14.013,00:55:16.216,00:00:02.203,,I only know one person going who I like,
00:55:16.216,00:55:18.486,00:00:02.270,,"so, no, two people going who I like",
00:55:18.486,00:55:19.229,00:00:00.743,,so there you go,
00:55:19.598,00:55:21.075,00:00:01.477,,,yeah I did like Winchester a lot
00:55:21.075,00:55:24.148,00:00:03.073,,,and I was like about I was pretty much going until my parents were like
00:55:24.581,00:55:26.203,00:00:01.622,,so you didn't like it or you did,
00:55:26.203,00:55:26.608,00:00:00.405,,so you didn't like it or you did,I liked it a lot
00:55:26.608,00:55:27.151,00:00:00.543,,,I liked it a lot
00:55:27.151,00:55:29.825,00:00:02.674,,,like I was like pretty much about to go to Winchester
00:55:29.825,00:55:31.840,00:00:02.015,,,and then my parents were like no
00:55:31.840,00:55:33.337,00:00:01.497,,,don't go there go here
00:55:33.337,00:55:34.993,00:00:01.656,,"I think, I think it's like, I think it's a better fit for me cause of the atmos.. like",don't go there go here
00:55:34.993,00:55:38.810,00:00:03.817,,"I think, I think it's like, I think it's a better fit for me cause of the atmos.. like",
00:55:38.810,00:55:42.316,00:00:03.506,,you know how Shadyside's like really preppy atmosphere like,
00:55:42.316,00:55:42.616,00:00:00.300,,you know how Shadyside's like really preppy atmosphere like,yeah
00:55:42.616,00:55:42.648,00:00:00.032,,you know how Shadyside's like really preppy atmosphere like,I mean I've never been
00:55:42.648,00:55:43.933,00:00:01.285,,,I mean I've never been
00:55:43.933,00:55:45.639,00:00:01.706,,,but like from what people have told me
00:55:45.639,00:55:45.909,00:00:00.270,,,it just seems
00:55:45.909,00:55:46.439,00:00:00.530,,yeah ,it just seems
00:55:46.439,00:55:46.587,00:00:00.148,,,it just seems
00:55:46.587,00:55:51.486,00:00:04.899,,but like Winches.. Winchester seems like oh we want you to be adored,
00:55:52.837,00:55:55.297,00:00:02.460,,whereas Shadyside is like oh you don't do sport,
00:55:55.297,00:55:55.437,00:00:00.140,,you suck,
00:55:55.437,00:55:56.229,00:00:00.792,,you suck,oh yeah I wouldn't fit in there then
00:55:56.229,00:55:58.031,00:00:01.802,,,oh yeah I wouldn't fit in there then
00:55:58.581,00:55:59.990,00:00:01.409,,oh I'd I'd never (inaudible),
00:55:59.990,00:56:01.480,00:00:01.490,,I hate it I hate it so much ,
00:56:04.180,00:56:05.680,00:00:01.500,,all my friends complain about it,
00:56:05.680,00:56:07.220,00:00:01.540,,and they all tell me how I should stay,
00:56:07.220,00:56:07.997,00:00:00.777,,and why I should stay,
00:56:08.000,00:56:11.047,00:00:03.047,,and I'm just like you hated here too you know,
00:56:15.353,00:56:18.740,00:00:03.387,,like I don't know for private school I think it's literally miserable,
00:56:20.173,00:56:22.966,00:00:02.793,,but I think I saw you at interview day at Winchester,
00:56:23.440,00:56:24.546,00:00:01.106,,that like just occurred to me ,
00:56:25.179,00:56:26.945,00:00:01.766,,,oh no I always saw you at TechNights
00:56:27.015,00:56:29.070,00:00:02.055,,,Do you still go to that
00:56:29.070,00:56:29.968,00:00:00.898,,,I don't go to that anymore
00:56:30.386,00:56:31.673,00:00:01.287,,I quit I hated it ,
00:56:31.934,00:56:33.171,00:00:01.237,,,I just couldn't go
00:56:33.460,00:56:34.900,00:00:01.440,,I got so sick of it,
00:56:34.900,00:56:38.007,00:00:03.107,,it was so like this thing because I've been going since fourth grade,
00:56:38.007,00:56:38.050,00:00:00.043,,so it's like,
00:56:38.050,00:56:38.493,00:00:00.443,,so it's like,fourth grade
00:56:38.493,00:56:38.788,00:00:00.295,,,fourth grade
00:56:38.828,00:56:39.257,00:00:00.429,,,oh wow
00:56:39.596,00:56:40.225,00:00:00.629,,,that's a long time
00:56:40.560,00:56:42.573,00:00:02.013,,they let me in early cause I'm special ,
00:56:43.128,00:56:44.655,00:00:01.527,,,I just started like a few months ago
00:56:44.804,00:56:46.680,00:00:01.876,,,but now I stopped going
00:56:46.680,00:56:47.628,00:00:00.948,,,oh they're coming back
00:56:48.400,00:56:51.153,00:00:02.753,,I was just kind of like it's boring now,
00:56:51.153,00:56:51.739,00:00:00.586,,I've seen it all so many times ,
00:56:51.739,00:56:52.856,00:00:01.117,,I've seen it all so many times ,yeah
00:56:52.856,00:56:53.193,00:00:00.337,,I've seen it all so many times ,
00:56:54.533,00:56:54.911,00:00:00.378,,hello,
00:56:54.911,00:56:55.280,00:00:00.369,hello,hello,
00:56:55.280,00:56:55.400,00:00:00.120,hello,,
00:56:56.468,00:57:00.638,00:00:04.170,"so you're done with the tutoring, say goodbye, hang up ",,
00:57:00.638,00:57:00.708,00:00:00.070,"so you're done with the tutoring, say goodbye, hang up ",okay ,
00:57:00.708,00:57:01.018,00:00:00.310,,okay ,
00:57:01.333,00:57:03.060,00:00:01.727,,I'm supposed to hang up,
00:57:03.931,00:57:04.797,00:00:00.866,,,okay bye
00:57:04.797,00:57:04.998,00:00:00.201,,bye,okay bye
00:57:04.998,00:57:05.275,00:00:00.277,,bye,
00:57:05.746,00:57:07.223,00:00:01.477,,I'll probably see you in the atrium thingy ,
00:57:07.223,00:57:08.086,00:00:00.863,you just made friends,I'll probably see you in the atrium thingy ,
00:57:08.086,00:57:08.640,00:00:00.554,you just made friends,,
