"Begin Time - hh:mm:ss.ms","End Time - hh:mm:ss.ms","Duration - hh:mm:ss.ms","default","Experimenter 1","Experimenter 2","P1","P2","Experimenter"
00:00:01.700,00:00:02.900,00:00:01.200,,"pause filler calibrate pause filler these with our server",,,,
00:00:03.200,00:00:07.500,00:00:04.300,,"so you go ahead and pause filler talk to each other introduce yourself",,,,
00:00:04.400,00:00:04.690,00:00:00.290,,,,"what?",,
00:00:05.400,00:00:05.910,00:00:00.510,,,,"yeah",,
00:00:07.500,00:00:08.200,00:00:00.700,,"get to know each other",,,,
00:00:08.400,00:00:09.800,00:00:01.400,,"and I'll be back in a few minutes",,,,
00:00:09.800,00:00:12.400,00:00:02.600,,"be in other room and calibrate and then there we go",,,,
00:00:12.400,00:00:19.200,00:00:06.800,,"just make sure that pause filler you're just both on the screen",,,,
00:00:19.200,00:00:21.500,00:00:02.300,,"well I'll be back in about five minutes",,,,
00:00:21.500,00:00:23.400,00:00:01.900,,,"you can hear them",,,
00:00:26.400,00:00:28.900,00:00:02.500,,,,"alright so hi I'm Joey",,
00:00:26.500,00:00:27.700,00:00:01.200,,,"you can hear them",,,
00:00:28.100,00:00:28.800,00:00:00.700,,,"all right awesome",,,
00:00:28.800,00:00:31.800,00:00:03.000,,,"introduce each other and just like be right back",,,
00:00:29.600,00:00:30.380,00:00:00.780,,,,,"I'm Tyler",
00:00:30.900,00:00:31.700,00:00:00.800,,,,"nice to meet you",,
00:00:32.150,00:00:33.000,00:00:00.850,,,,,"nice to meet you too",
00:00:33.530,00:00:35.600,00:00:02.070,,,,"so pause filler how old are you",,
00:00:35.600,00:00:36.400,00:00:00.800,,,,"what grade are you in",,
00:00:37.480,00:00:38.550,00:00:01.070,,,,,"ninth and I'm fifteen",
00:00:39.000,00:00:39.660,00:00:00.660,,,,"awesome",,
00:00:42.000,00:00:46.800,00:00:04.800,,,,"okay so pause filler where do you go to school",,
00:00:47.300,00:00:47.900,00:00:00.600,,,,,"Brashear",
00:00:47.900,00:00:53.600,00:00:05.700,,,,"oh fine yeah I'm actually also ninth grade",,
00:00:53.600,00:00:54.700,00:00:01.100,,,,"I go to Dice",,
00:00:54.700,00:00:56.800,00:00:02.100,,,,,"do you know Michael Baldwin",
00:00:57.500,00:00:59.460,00:00:01.960,,,,"I don't think so",,
00:01:01.600,00:01:03.300,00:00:01.700,,,,"I don't know a ton of people",,
00:01:06.380,00:01:07.000,00:00:00.620,,,,"yeah",,
00:01:08.000,00:01:13.000,00:00:05.000,,,,"so how did you get into this program",,
00:01:14.000,00:01:15.000,00:00:01.000,,,,,"(inaudible)",
00:01:17.890,00:01:18.410,00:00:00.520,,,,"same",,
00:01:27.000,00:01:27.800,00:00:00.800,,,,,"I'm tired",
00:01:28.000,00:01:28.800,00:00:00.800,,,,"uh-huh",,
00:01:30.480,00:01:31.010,00:00:00.530,,,,"well",,
00:01:32.100,00:01:33.900,00:00:01.800,,,,"oh oh not much we can do I mean",,
00:01:35.960,00:01:36.310,00:00:00.350,,,,"yeah",,
00:01:38.100,00:01:40.900,00:00:02.800,,,,"sleep is something good to get",,
00:01:40.900,00:01:41.400,00:00:00.500,,,,"I don't know",,
00:01:43.400,00:01:47.000,00:00:03.600,,,,"I'm usually tired almost every day",,
00:01:47.200,00:01:48.400,00:00:01.200,,,,"it's what high school does",,
00:01:59.000,00:02:02.100,00:00:03.100,,,,"are we supposed to start",,
00:02:02.100,00:02:03.600,00:00:01.500,,,,"or we're just waiting for it",,
00:02:04.000,00:02:06.000,00:00:02.000,,,,,"(inaudible)",
00:02:06.300,00:02:07.100,00:00:00.800,,,,"okay (inaudible)",,
00:03:55.800,00:03:57.200,00:00:01.400,,,,,"I don't know (inaudible)",
00:03:57.500,00:03:58.600,00:00:01.100,,,,"(inaudible) what do you mean we're supposed",,
00:03:59.800,00:04:02.000,00:00:02.200,,,,,"I don't know what we're supposed to do",
00:04:01.900,00:04:05.400,00:00:03.500,,,,"yeah sure we're supposed to start",,
00:04:05.400,00:04:07.100,00:00:01.700,,,,,"he talk the one stylus pen",
00:04:07.400,00:04:11.800,00:00:04.400,,,,"really oh I think maybe there's a problem",,
00:04:11.800,00:04:12.500,00:00:00.700,,,,"I don't know",,
00:04:14.390,00:04:14.780,00:00:00.390,,,,"maybe",,
00:04:16.900,00:04:20.100,00:00:03.200,,,,"we're letting them like fifteen minutes",,
00:04:20.100,00:04:23.000,00:00:02.900,,,,"so it looks like (inaudible)",,
00:05:58.000,00:06:01.500,00:00:03.500,,,,"oh my god what's taking them so long",,
00:06:01.100,00:06:11.800,00:00:10.700,,,,,,"all right hope that you guys got the chance to get to know each other a little bit"
00:06:03.000,00:06:03.800,00:00:00.800,,,,,"here they go",
00:06:11.200,00:06:11.900,00:00:00.700,,,,"yeah",,
00:06:11.800,00:06:12.700,00:00:00.900,,,,,,"pause filler so there you go"
00:06:12.700,00:06:13.800,00:00:01.100,,,,,,"stylus is calibrated"
00:06:14.300,00:06:15.900,00:00:01.600,,,"did it came pretty well",,,
00:06:16.900,00:06:20.700,00:00:03.800,,,"so now we're actually ready to begin tutoring",,,
00:06:20.700,00:06:23.100,00:00:02.400,,,"so if you could just pause filler click the Google icon face",,,
00:06:23.100,00:06:25.100,00:00:02.000,,,,,,"so take about twenty minutes"
00:06:25.100,00:06:29.000,00:00:03.900,,,,,,"and he'll be pause filler tutoring you and good luck"
00:06:29.000,00:06:32.200,00:00:03.200,,,"there we go and actually close the first tab",,,
00:06:32.400,00:06:33.000,00:00:00.600,,,,"the first tab",,
00:06:33.400,00:06:33.800,00:00:00.400,,,"yes",,,
00:06:37.000,00:06:37.600,00:00:00.600,,,,"this one",,
00:06:37.800,00:06:47.000,00:00:09.200,,,"yes pause filler do you want to live this on here or oops is that your (inaudible)",,,
00:06:38.540,00:06:39.030,00:00:00.490,,,,"okay",,
00:06:41.200,00:06:43.000,00:00:01.800,,,,"(inaudible) on here or oops",,
00:06:46.000,00:06:47.400,00:00:01.400,,,,"okay okay",,
00:06:47.600,00:06:55.300,00:00:07.700,,,"let me change your color to green please so yes again",,,
00:06:55.300,00:06:59.000,00:00:03.700,,,"you'll have ten of these problems to go through and",,,
00:06:59.000,00:07:04.600,00:00:05.600,,,"pause filler that works you kind of give you a general concept level to them",,,
00:07:04.360,00:07:04.600,00:00:00.240,,,,"yeah",,
00:07:05.200,00:07:13.400,00:00:08.200,,,"so just try to help them through pause filler solving the problem on their own and well that's",,,
00:07:13.400,00:07:17.000,00:00:03.600,,,"pause filler if you get to a like eleven pause filler you could stop",,,
00:07:15.210,00:07:15.910,00:00:00.700,,,,"okay",,
00:07:17.100,00:07:19.300,00:00:02.200,,,"and we'll take care of the rest",,,
00:07:17.770,00:07:18.250,00:00:00.480,,,,"okay",,
00:07:19.300,00:07:21.100,00:00:01.800,,,"pause filler so if you could just oh and I'm sorry",,,
00:07:21.400,00:07:23.700,00:00:02.300,,,"you can switch problems by clicking these arrows",,,
00:07:23.420,00:07:23.780,00:00:00.360,,,,"okay",,
00:07:24.000,00:07:28.300,00:00:04.300,,,"so pause filler go to one",,,
00:07:29.300,00:07:38.600,00:00:09.300,,,"and pause filler when you (inaudible) pause filler just click the next button",,,
00:07:32.500,00:07:33.200,00:00:00.700,,,,"alright",,
00:07:36.400,00:07:40.040,00:00:03.640,,,,"so get back to one all right",,
00:07:41.000,00:07:44.890,00:00:03.890,,,,"so do you know the basic idea of how to do this?",,
00:07:45.200,00:07:46.120,00:00:00.920,,,,,"mm-hmm",
00:07:46.200,00:07:50.100,00:00:03.900,,,,"okay so can you just I don't know",,
00:07:50.700,00:07:52.000,00:00:01.300,,,,"so what's the answer",,
00:07:52.600,00:07:53.200,00:00:00.600,,,,,"nineteen",
00:07:53.700,00:07:59.900,00:00:06.200,,,,"awesome okay so just (inaudible) work just adding that all right",,
00:07:59.900,00:08:02.000,00:00:02.100,,,,"so this base idea you can just",,
00:08:03.500,00:08:04.500,00:00:01.000,,,,"do you have any answer",,
00:08:05.600,00:08:06.400,00:00:00.800,,,,,"for this one",
00:08:06.300,00:08:06.900,00:00:00.600,,,,"yeah",,
00:08:11.900,00:08:12.700,00:00:00.800,,,,,"pause filler seven",
00:08:14.400,00:08:22.600,00:00:08.200,,,,"okay so when we have a negative right here we want to the other side",,
00:08:23.300,00:08:25.300,00:00:02.000,,,,"we want to add it",,
00:08:25.300,00:08:26.800,00:00:01.500,,,,,"add it on both sides",
00:08:26.800,00:08:33.000,00:00:06.200,,,,"yeah and then sorry for my handwriting and so fifteen",,
00:08:33.900,00:08:34.600,00:00:00.700,,,,"you add that",,
00:08:34.600,00:08:39.400,00:00:04.800,,,,"and you got twenty-three equals k",,
00:08:39.400,00:08:42.600,00:00:03.200,,,,"all right does that makes sense",,
00:08:40.400,00:08:41.050,00:00:00.650,,,,,"mm-hmm",
00:08:42.000,00:08:42.700,00:00:00.700,,,,,"mm-hmm",
00:08:42.900,00:08:47.200,00:00:04.300,,,,"awesome okay next question so can you try this again",,
00:08:49.200,00:08:50.600,00:00:01.400,,,,,"negative six",
00:08:51.100,00:08:53.700,00:00:02.600,,,,"awesome so you know subtraction cool",,
00:08:59.400,00:09:02.200,00:00:02.800,,,,"okay so here here's a good question",,
00:09:02.200,00:09:04.200,00:00:02.000,,,,"can you do this one for me",,
00:09:04.900,00:09:07.040,00:00:02.140,,,,,"pause filler minus fourteen",
00:09:07.330,00:09:07.800,00:00:00.470,,,,"yeah",,
00:09:37.500,00:09:38.400,00:00:00.900,,,,,"five",
00:09:38.700,00:09:39.900,00:00:01.200,,,,"awesome cool",,
00:09:43.000,00:09:49.000,00:00:06.000,,,,"yeah this one is (inaudible) right here",,
00:09:49.000,00:09:51.880,00:00:02.880,,,,"okay so here's a two separate equation",,
00:09:52.000,00:09:53.200,00:00:01.200,,,,"so you should do that",,
00:09:54.200,00:09:54.800,00:00:00.600,,,,,"pause filler",
00:10:12.480,00:10:13.710,00:00:01.230,,,,,"hmm",
00:10:23.700,00:10:26.440,00:00:02.740,,,,"so do you know how to do this right",,
00:10:26.800,00:10:27.500,00:00:00.700,,,,,"mm-hmm",
00:10:27.800,00:10:33.500,00:00:05.700,,,,"yeah so you're not really going to get a whole number",,
00:10:33.500,00:10:36.800,00:00:03.300,,,,"so just kind of tell me what fraction you got at the end was",,
00:10:38.300,00:10:40.000,00:00:01.700,,,,,"hmm",
00:10:43.700,00:10:45.300,00:00:01.600,,,,,"oh I like this pen",
00:10:51.710,00:10:52.640,00:00:00.930,,,,,"(inaudible)",
00:10:53.000,00:10:59.890,00:00:06.890,,,,"yeah okay so yeah so let's do it here",,
00:10:59.890,00:11:01.800,00:00:01.910,,,,"so you add nine to both sides",,
00:11:02.100,00:11:02.750,00:00:00.650,,,,,"uh-huh",
00:11:03.700,00:11:10.800,00:00:07.100,,,,"and then so you have thirteen p equals fifty",,
00:11:11.400,00:11:21.080,00:00:09.680,,,,"and you got thirteen pause filler end up with p equals fifty divided by thirteen",,
00:11:22.000,00:11:25.600,00:00:03.600,,,,"and if you want to solve that out or just do that",,
00:11:25.600,00:11:29.400,00:00:03.800,,,,"you don't really have to questions like that",,
00:11:29.400,00:11:33.000,00:00:03.600,,,,"it's either you got a fraction",,
00:11:33.000,00:11:33.900,00:00:00.900,,,,"you should leave it like that",,
00:11:33.900,00:11:35.200,00:00:01.300,,,,"or put it here okay",,
00:11:35.200,00:11:38.000,00:00:02.800,,,,"so next question can you do this please",,
00:11:38.500,00:11:39.440,00:00:00.940,,,,,"mm-hmm",
00:11:40.000,00:11:41.500,00:00:01.500,,,,"someone's watching us here",,
00:11:42.400,00:11:47.020,00:00:04.620,,,,,"yeah let's see oh something",
00:11:48.300,00:11:49.400,00:00:01.100,,,,"what",,
00:11:49.500,00:11:52.000,00:00:02.500,,,,,"so something's messing up with this pen",
00:11:52.400,00:11:52.600,00:00:00.200,,,,"aw",,
00:11:56.000,00:11:58.770,00:00:02.770,,,,,"just clicking new tabs and stuff",
00:11:59.200,00:11:59.990,00:00:00.790,,,,"uh-huh",,
00:12:01.700,00:12:08.040,00:00:06.340,,,,"oh pause filler so try to go back to the one you are pause filler in the first one",,
00:12:10.630,00:12:11.140,00:00:00.510,,,,,"(inaudible)",
00:12:43.000,00:12:43.900,00:00:00.900,,,,,"it's four",
00:12:44.400,00:12:56.100,00:00:11.700,,,,"awesome okay onto the next question okay so let's work on this",,
00:12:56.100,00:13:01.000,00:00:04.900,,,,"seven equals sixteen",,
00:13:15.300,00:13:16.000,00:00:00.700,,,,"okay",,
00:13:26.600,00:13:29.050,00:00:02.450,,,,"this is another one where you're not going to get a whole number",,
00:13:29.500,00:13:30.000,00:00:00.500,,,,,"uh-huh",
00:14:01.580,00:14:02.070,00:00:00.490,,,,"okay",,
00:14:06.400,00:14:16.000,00:00:09.600,,,,"so you pause filler what you're doing it's the same it's again probably pretty much the same thing as the one we did earlier it's just pause filler",,
00:14:17.600,00:14:18.600,00:00:01.000,,,,,"but it works",
00:14:19.000,00:14:24.800,00:00:05.800,,,,"yeah so really it doesn't matter where the k ends",,
00:14:24.800,00:14:28.000,00:00:03.200,,,,"it just matters where you pause filler",,
00:14:28.800,00:14:32.600,00:00:03.800,,,,"I mean you just want to have the k by itself on one side",,
00:14:34.200,00:14:40.900,00:00:06.700,,,,"and so what you want to try to do is you want to get",,
00:14:42.200,00:14:44.800,00:00:02.600,,,,"oops sorry you want to get this",,
00:14:44.900,00:14:49.200,00:00:04.300,,,,"oops you want to get this over here",,
00:14:50.300,00:14:54.300,00:00:04.000,,,,"and you want to get that fifteen over here",,
00:14:55.200,00:15:02.300,00:00:07.100,,,,"and so basically when you're working with these you want to pause filler you pause filler",,
00:15:02.300,00:15:07.400,00:00:05.100,,,,"it's kind of like an inverse operations inverse order of operations type of thing",,
00:15:07.400,00:15:13.700,00:00:06.300,,,,"so you want to do addition or subtraction first and then multiplication or division",,
00:15:15.500,00:15:21.300,00:00:05.800,,,,"so you're going to start with getting the twenty-two to the other side and then dividing by fifteen",,
00:15:37.000,00:15:39.900,00:00:02.900,,,,,"(inaudible) should just give us the (inaudible)",
00:15:41.200,00:15:45.600,00:00:04.400,,,,"yeah or maybe it's like some kind of test or something",,
00:15:45.600,00:15:50.600,00:00:05.000,,,,"okay so here we have a negative number here",,
00:15:51.400,00:15:53.700,00:00:02.300,,,,"so you want to add it",,
00:15:53.700,00:15:55.900,00:00:02.200,,,,"and then you have a multiplication",,
00:15:57.000,00:15:59.000,00:00:02.000,,,,"you want to give so multiply",,
00:15:59.000,00:16:03.900,00:00:04.900,,,,"so you want to divide it",,
00:16:06.600,00:16:11.300,00:00:04.700,,,,"and so this is first",,
00:16:11.300,00:16:12.900,00:00:01.600,,,,"and then this is second",,
00:16:41.700,00:16:43.700,00:00:02.000,,,,,"well it is making me mad",
00:16:47.100,00:16:51.400,00:00:04.300,,,,"yeah okay so let's do this together",,
00:16:51.400,00:16:54.500,00:00:03.100,,,,"so we have twenty-two and some negative",,
00:16:54.800,00:16:59.900,00:00:05.100,,,,"so we want to add twenty-two to both sides so",,
00:17:00.300,00:17:03.200,00:00:02.900,,,,"and that gets rid of this twenty-two",,
00:17:03.200,00:17:11.300,00:00:08.100,,,,"and that makes this sixty-two courtesy of this fifteen right here",,
00:17:12.300,00:17:14.400,00:00:02.100,,,,"and since it's multiplied b k",,
00:17:14.400,00:17:15.800,00:00:01.400,,,,"you want to divide it",,
00:17:17.000,00:17:22.200,00:00:05.200,,,,"so you divide sixty-two by fifteen",,
00:17:23.100,00:17:24.200,00:00:01.100,,,,"and that equals k",,
00:17:33.000,00:17:35.300,00:00:02.300,,,,,"what then k equals pause filler",
00:17:35.900,00:17:37.600,00:00:01.700,,,,"k equals sixty-two",,
00:17:37.600,00:17:44.200,00:00:06.600,,,,,"k equals sixty-two sixty-two divided by five is like four",
00:17:45.000,00:17:46.400,00:00:01.400,,,,"it's divided by fifteen",,
00:17:46.400,00:17:49.600,00:00:03.200,,,,"and it's about four yeah",,
00:17:50.500,00:17:51.300,00:00:00.800,,,,"so that's good",,
00:17:51.400,00:17:55.400,00:00:04.000,,,,"it's four and two fifteens okay so next question",,
00:17:58.000,00:17:58.510,00:00:00.510,,,,"okay",,
00:18:00.500,00:18:02.900,00:00:02.400,,,,"this one is also pretty easy",,
00:18:03.000,00:18:05.230,00:00:02.230,,,,"so that's one of the easier ones",,
00:18:13.600,00:18:14.500,00:00:00.900,,,,,"there's three",
00:18:15.100,00:18:15.700,00:00:00.600,,,,"what",,
00:18:15.900,00:18:16.500,00:00:00.600,,,,,"three",
00:18:16.800,00:18:18.700,00:00:01.900,,,,"yeah awesome",,
00:18:23.200,00:18:23.900,00:00:00.700,,,,"great",,
00:18:25.700,00:18:27.440,00:00:01.740,,,,"next question okay",,
00:18:29.800,00:18:30.700,00:00:00.900,,,,"that is",,
00:18:30.700,00:18:31.500,00:00:00.800,,,,,"three again",
00:18:31.800,00:18:33.300,00:00:01.500,,,,"three yeah well",,
00:18:39.200,00:18:40.100,00:00:00.900,,,,"great okay",,
00:18:43.400,00:18:46.000,00:00:02.600,,,,"question is okay",,
00:18:47.700,00:18:50.800,00:00:03.100,,,,"so you have k on both sides",,
00:18:50.800,00:18:55.100,00:00:04.300,,,,"so you want to get both of the Ks just to one side",,
00:18:55.600,00:18:58.300,00:00:02.700,,,,"and since you have more Ks over here",,
00:18:58.300,00:19:00.700,00:00:02.400,,,,"you want to get rid of this k",,
00:19:01.800,00:19:05.600,00:00:03.800,,,,"so since if there's no positive or negative sign next to it",,
00:19:05.600,00:19:07.800,00:00:02.200,,,,"that means it's positive",,
00:19:09.200,00:19:12.100,00:00:02.900,,,,"so you would subtract k from both sides",,
00:19:13.500,00:19:20.900,00:00:07.400,,,,"and so you would have negative ten equals seven k minus sixty-eight",,
00:19:21.200,00:19:23.700,00:00:02.500,,,,"and then can you work out from there",,
00:19:24.000,00:19:24.900,00:00:00.900,,,,,"um hmm",
00:19:41.300,00:19:43.090,00:00:01.790,,,,,"like add something",
00:19:43.400,00:19:45.500,00:00:02.100,,,,"okay so let's close it",,
00:19:45.700,00:19:49.900,00:00:04.200,,,,"so this is negative",,
00:19:50.000,00:19:51.600,00:00:01.600,,,,"we want to add it to both sides",,
00:19:51.600,00:19:52.800,00:00:01.200,,,,"so since this is",,
00:19:53.200,00:19:55.500,00:00:02.300,,,,"so you add sixty-eight to both sides",,
00:19:56.400,00:19:59.100,00:00:02.700,,,,"and so you have negative ten on this side",,
00:20:00.000,00:20:04.800,00:00:04.800,,,,"so that's basically saying sixty-eight plus negative ten is also right",,
00:20:05.600,00:20:11.000,00:00:05.400,,,,"yeah sixty-eight minus ten is negative ten plus sixty-eight",,
00:20:11.200,00:20:21.100,00:00:09.900,,,,"so you have sixty-eight minus ten equals seven k",,
00:20:22.200,00:20:29.200,00:00:07.000,,,,"and so you have fifty-eight equals seven k",,
00:20:30.100,00:20:32.100,00:00:02.000,,,,"so can you do that",,
00:20:32.660,00:20:33.150,00:00:00.490,,,,,"mm-hmm",
00:20:34.900,00:20:36.600,00:00:01.700,,,,,"so fifty-eight minus seven k",
00:20:37.800,00:20:39.700,00:00:01.900,,,,"fifty-eight equals seven k",,
00:20:39.800,00:20:41.120,00:00:01.320,,,,"so my handwriting is terrible",,
00:20:49.600,00:20:51.000,00:00:01.400,,,,,"four something",
00:21:15.000,00:21:17.400,00:00:02.400,,,,,"oh that equals",
00:21:19.100,00:21:21.900,00:00:02.800,,,,,"I think it's like eight around eight",
00:21:21.000,00:21:21.550,00:00:00.550,,,,"yup",,
00:21:22.200,00:21:23.700,00:00:01.500,,,,"yeah that's exactly eight",,
00:21:28.300,00:21:29.200,00:00:00.900,,,,"awesome",,
00:21:30.100,00:21:33.400,00:00:03.300,,,,"so that is ten questions",,
00:21:35.700,00:21:36.990,00:00:01.290,,,,"so there we go",,
00:21:41.000,00:21:41.900,00:00:00.900,,,,"awesome",,
00:21:44.000,00:21:46.200,00:00:02.200,,,,"so now we kind of just wait",,
00:21:47.700,00:21:51.990,00:00:04.290,,,,,"do you have another tab open as Scribbler over",
00:21:52.500,00:21:53.000,00:00:00.500,,,,"yeah",,
00:21:53.100,00:21:55.700,00:00:02.600,,,,,"I think that one we're supposed to do next",
00:21:57.800,00:22:00.300,00:00:02.500,,,,"all right I don't know",,
00:22:00.300,00:22:03.230,00:00:02.930,,,,"they just told me to go to eleven and then stop",,
00:22:03.230,00:22:06.870,00:00:03.640,,,,"so who knows",,
00:22:11.000,00:22:14.100,00:00:03.100,,,,"maybe for someone else there another time",,
00:22:38.900,00:22:40.800,00:00:01.900,,,,"or maybe we're supposed to",,
00:22:41.200,00:22:46.430,00:00:05.230,,,,"actually I think we're supposed to come out and actually get them",,
00:22:47.600,00:22:48.700,00:00:01.100,,,,,"okay",
00:22:49.700,00:23:33.800,00:00:44.100,,,,,,"good job so you unlocked the pause filler bonus stage who just like (inaudible)"
00:23:33.900,00:23:35.300,00:00:01.400,,,"so can we have more (inaudible)",,,
00:23:35.300,00:23:48.600,00:00:13.300,,,"okay let me just get to the oh yeah okay",,,
00:23:48.700,00:23:52.700,00:00:04.000,,,"so I think the additional ones are only going up to twenty-four",,,
00:23:50.300,00:23:52.700,00:00:02.400,,,,"so are we going up to twenty-four",,
00:23:55.000,00:23:55.800,00:00:00.800,,,,"okay",,
00:23:55.100,00:24:10.400,00:00:15.300,,,"okay in this (inaudible) on here like this one is just going to be a little bit difficult so then also like the answering guide",,,
00:24:10.400,00:24:13.800,00:00:03.400,,,"just do those doable and (inaudible)",,,
00:24:16.000,00:24:21.300,00:00:05.300,,,,"all right so we have another ten questions to do",,
00:24:21.500,00:24:23.800,00:00:02.300,,,,,"yeah I want to switch to this computer",
00:24:25.600,00:24:26.550,00:00:00.950,,,,"yeah okay",,
00:24:26.700,00:24:27.560,00:00:00.860,,,,,"how to do that",
00:24:28.100,00:24:29.500,00:00:01.400,,,,,"oh one second",
00:25:56.230,00:25:57.700,00:00:01.470,,,,,"I don't know why we're kind of through this",
00:25:58.300,00:26:06.800,00:00:08.500,,,,"all right so do you want to start working on this",,
00:26:09.500,00:26:10.120,00:00:00.620,,,,,"yeah",
00:26:10.700,00:26:11.700,00:00:01.000,,,,"so let's just",,
00:26:16.900,00:26:19.000,00:00:02.100,,,,"we should remember what our signs are",,
00:26:19.500,00:26:20.600,00:00:01.100,,,,"this is the negative",,
00:26:20.600,00:26:21.700,00:00:01.100,,,,"this is the negative",,
00:26:22.200,00:26:23.600,00:00:01.400,,,,"this is the positive",,
00:26:24.000,00:26:24.800,00:00:00.800,,,,"that's a positive",,
00:26:24.800,00:26:27.000,00:00:02.200,,,,"so you can try to do that",,
00:26:42.000,00:26:42.540,00:00:00.540,,,,"oh",,
00:26:43.100,00:26:44.600,00:00:01.500,,,,,"oh my gosh this mouse (inaudible)",
00:26:46.000,00:26:48.600,00:00:02.600,,,,"okay wait don't press the wrong button",,
00:26:50.000,00:26:53.000,00:00:03.000,,,,"let's go there there okay",,
00:27:02.000,00:27:03.400,00:00:01.400,,,,,"I don't know none of this",
00:27:03.900,00:27:11.300,00:00:07.400,,,,"okay so here so you want to get the r on just one side",,
00:27:11.600,00:27:14.300,00:00:02.700,,,,"so since you have less r on here",,
00:27:14.300,00:27:15.000,00:00:00.700,,,,"you just have one r",,
00:27:15.000,00:27:17.000,00:00:02.000,,,,"so you subtract r from this side",,
00:27:18.700,00:27:20.000,00:00:01.300,,,,"and subtract r from that side",,
00:27:20.000,00:27:24.200,00:00:04.200,,,,"and you have negative thirty-three equals r",,
00:27:24.200,00:27:26.000,00:00:01.800,,,,"because you subtract to one",,
00:27:26.400,00:27:29.800,00:00:03.400,,,,,,"so that's it for this half"
00:27:27.400,00:27:29.380,00:00:01.980,,,,,"for this half for what",
00:27:30.700,00:27:35.600,00:00:04.900,,,,,,"pause filler the study so pause filler you're finished being tutored"
00:27:35.600,00:27:37.200,00:00:01.600,,,,,,"we're going to take a little bit of a break"
00:27:37.500,00:27:39.500,00:00:02.000,,,,,,"you guys stay on the line"
00:27:39.500,00:27:41.000,00:00:01.500,,,,,,"hang out and talk"
00:27:41.000,00:27:43.000,00:00:02.000,,,,,,"have some Skittles"
00:27:42.800,00:27:43.600,00:00:00.800,,,,,"thank you",
00:27:43.700,00:27:46.200,00:00:02.500,,,,,,"pause filler yeah take five minutes"
00:27:46.200,00:27:48.200,00:00:02.000,,,,,,"relax and then talk"
00:27:48.200,00:27:50.000,00:00:01.800,,,,,,"and then you guys switch"
00:27:50.000,00:27:50.800,00:00:00.800,,,,,,"and then we'll do that"
00:27:50.800,00:27:53.200,00:00:02.400,,,"and so you're going to be tutored for this one",,,
00:27:53.200,00:27:57.900,00:00:04.700,,,"you're writing in green text before correct",,,
00:27:56.200,00:27:56.800,00:00:00.600,,,,"yeah",,
00:27:58.000,00:28:01.400,00:00:03.400,,,"okay so you'll be writing in black text now",,,
00:27:58.200,00:27:59.200,00:00:01.000,,,,"yeah",,
00:28:01.600,00:28:04.400,00:00:02.800,,,"guys you hang out a bit more",,,
00:28:04.500,00:28:09.700,00:00:05.200,,,"so we're just going to watch this and (inaudible)",,,
00:28:09.700,00:28:14.600,00:00:04.900,,,"because you're going to get some Skittles",,,
00:28:15.300,00:28:17.600,00:00:02.300,,,"here you go",,,
00:28:17.900,00:28:18.800,00:00:00.900,,,"and take one",,,
00:28:19.200,00:28:29.000,00:00:09.800,,,"so yeah just chill pause filler for a bit",,,
00:28:26.200,00:28:34.000,00:00:07.800,,,,,"you know what thirty minutes plus now we have twenty five minutes work",
00:28:29.000,00:28:33.800,00:00:04.800,,,"and we'll do that",,,
00:28:34.800,00:28:35.400,00:00:00.600,,,,"okay",,
00:29:32.310,00:29:32.810,00:00:00.500,,,,,"ouch",
00:29:36.200,00:29:39.100,00:00:02.900,,,,,"wait did he take my stylus again",
00:29:41.600,00:29:46.000,00:00:04.400,,,,,"oh my gosh he's always taking my stylus",
00:29:46.750,00:29:47.260,00:00:00.510,,,,"yeah",,
00:30:11.900,00:30:13.700,00:00:01.800,,,,,"this is a big microphone",
00:30:14.300,00:30:15.000,00:00:00.700,,,,"yeah",,
00:30:24.000,00:30:25.180,00:00:01.180,,,,"testing",,
00:31:45.000,00:31:45.700,00:00:00.700,,,,,"(inaudible)",
00:31:48.000,00:31:55.900,00:00:07.900,,,,"yeah they have like a giant super computer connected to a terrible dumb monitors kind of funny",,
00:32:30.100,00:32:32.100,00:00:02.000,,,,,"(inaudible)",
00:32:33.600,00:32:34.000,00:00:00.400,,,,"yeah",,
00:33:00.000,00:33:01.700,00:00:01.700,,,,,"pause filler isn't it",
00:34:11.400,00:34:13.100,00:00:01.700,,,,,"they'll return five minutes",
00:34:14.500,00:34:15.200,00:00:00.700,,,,"I don't know",,
00:34:15.200,00:34:19.100,00:00:03.900,,,,"I don't think they're very good at telling time so far",,
00:34:20.800,00:34:25.500,00:00:04.700,,,,"they don't exactly keep their promises",,
00:34:27.200,00:34:29.100,00:00:01.900,,,,,"well here they come now",
00:34:29.100,00:34:31.300,00:00:02.200,,,,,"I think they can hear us or see us",
00:34:32.500,00:34:33.000,00:00:00.500,,,,"probably",,
